对吧是开发的工程师呢those soft engineer who develop these systems,technology,more
对就是你一签下去之后就your life depends depends on,technology,more
make sense的一个东西就比如说今天全部的车子都有self's driving的这个function,technology,more
那驾驶人是自己可以决定我要不要去按那下那个button然后说诶开启self driving motion,technology,more
去那其其实是可以very easy to destroy this company,technology,more
fame你的所有的一切trust customer trust毁灭一旦,technology,more
是讲到这self driving car其实我个人觉得,technology,more
就是some parts are easy some parts are hard easy part makes like,technology,more
可以在短时间内我认为三到五年就可以fully functional的,technology,more
就是比如说self driving car uh the most difficult part i think is,technology,more
大城市大大区域较大的国家像是美国或是中国这种很很长时间是需要那种大卡车在高速公路上移动这种其实very easy to be replaced by,technology,more
对那我认为self driving的话现在就是卡在,technology,more
一般的用卖车的时候这个你不能说哦我这台车only for freeway,technology,more
那里开嘛所以他必须要应付各种情况各种雪地呀呃呃高速公路啊市区啊路道啊小路窄路宽路全部都anything need to be,technology,more
involve in  scenario所以我认为这是一个比较困难的的点,technology,more
你懂吗就是more close to people's life,technology,more
ok这个其实我有很多可以讲因为我有一个you know I have a sister which is younger nine years old younger than me,technology,more
and我的generation呢我们是没有smart phone的她的generation呢she is grown up with smart phone,technology,more
她的那个世代在我们这个世代没有手机是一件非常正常a very common thing,technology,more
所有的人百分之九十九就是应该叫九十五part九十percent以上的人呢都有smart phone,technology,more
所以当你没有smart phone的时候就变得很奇怪的一件事情而且所有人的社交啊,technology,more
交朋友诶你要跟最好朋友你一定有他家的电话号码吧然后you will also remember the birthday,technology,more
并不是remind by facebook right and also,technology,more
那可能有些像我妹给我讲就是说some people say something in the group in your line group,technology,more
好那这就回到what my parents think,technology,more
比较那个但是我我我后来是担任的角色是我去persuade my parents to give my  sister a cell a smart phone,technology,more
然后my mom is very exist非常坚持不要不要给,technology,more
对那我我我后来是真的是觉得this is generation difference really,technology,more
and you should like你应该是教他怎么样去smartly use smart phone,technology,more
就是我我一开始很不了不理解我父母的关系就是说哦上大学以后we get into get into the good university then you can get a smartphone,technology,more
like i saw so many example like进入university之后then,technology,more
诶进来的时候诶  看到top ten percent,technology,more
然后慢慢地慢慢地越玩越玩越晚然后到最后就是连毕业it's hard even hard for them to graduate,technology,more
所以she told me how embarrassed she take out this phone in front of,technology,more
呃touch screen,technology,more
right呃the first time is第的第一次见面的时候第一就是哎,technology,more
算是业内人so do you trust artificial intelligence,technology,more
AI现在越来越human like,technology,more
嗯AI会嗯hurt us就是会伤害我们,technology,more
技术base a technology and we hands a technology it's still human,technology,more
So there will be some kind of呃factors,technology,more
就是哪怕是我们human being其实也只是整个你可以认为是生物界或者说某种,technology,more
那ai它虽然是由我们创造的created by us but maybe there are another special species它们也有可能是一个特殊的物种它有可能会取代我们,technology,more
所以嗯你刚才的话呢啊remind me of a example,technology,more
em it's a project啊that's an这个paper就是关于怎么用啊CV的一些方法嗯去辨别homosexual,technology,more
嗯um使用ai的人是evil的但是ai ai这项技术本身嗯it's not evil,technology,more
嗯所以我也同意你的观点嗯那它我们能否呃trust ai嗯其实是说我们能不能相信,technology,more
um humanity能不能相信人性,technology,more
呃因事而立it depends,technology,more
啊i believe current technologies are,technology,more
moving on this direction啊就是比如说我说一个example,technology,more
呃they are not generated by,technology,more
possible reason就是,technology,more
这个training set本来就是人挑选出来的已经有一定那个,technology,more
for me i think um审美其实是有一些内容和表达的,technology,more
呃you have mentioned that machine can generate some beautiful pictures,technology,more
那么嗯第二个问题是嗯do you  use any social media,technology,more
呃the future for connecting people,technology,more
嗯hate speech的地方,technology,more
而且他们有很多很丰富的功能例如呃you can do a a video chat or just voice chat,technology,more
我还是比较支持就是social media can like make us closer,technology,more
um like you said uh social media是一个非常棒的tool能够,technology,more
能够让我们彼此close to each other,technology,more
当然你也提到了这个social media上存在一些,technology,more
从social media上散布开来然后大家开始um,technology,more
like crazy呀还有就是疯狂的,technology,more
呃当然我认为这个是regular regulation的问题是这个social media,technology,more
呃规定好的一些提前预定好pre define的一些,technology,more
呃the use,technology,more
嗯why uh,education,more
就找工作就先从summer internship,education,more
um I first um um就是不能适应它的climate之类的就,education,more
um I remember I was sick and the first time when I um就是在我参加军训的时候我就已经水土不服病得很厉害,education,more
然后呃actually my parents is in Shandong province travelling then but,education,more
it has eight campuses in Shandong province and six in济南 um one in威海one in Qingdao so it's very large but,education,more
but I think maybe you can嗯就装修一下就更好了我觉得太老了确实是,education,more
嗯我觉得你说比如说你你是来自于广东然后你去山东学习其实我虽然这个但我觉得也有点类似于那种oversea study,education,more
呃so uh,philosophy,more
就是here's a question,philosophy,more
就是will you kill ten people to save one,philosophy,more
就是我之前看到一个这个question the setting就是说,philosophy,more
kill one people的话你save了十个people,philosophy,more
in the short term来看的话you save the save,philosophy,more
那你从short term来看的话你是,philosophy,more
呃save the九个人其实,philosophy,more
对pure save的是是九个人,philosophy,more
这是从short term来看的话但是我但是如果你从long time long term来看的话你其实是在,philosophy,more
这是从long time来看的话就会更多的人会选择是在铁轨上玩,philosophy,more
呃就是can他们可以他们可以valid the rule然后without any punishment,philosophy,more
他们就会disobey the rule just because,philosophy,more
我还是会选择去kill ten people因为,philosophy,more
那么也许这就是worth it,philosophy,more
他们both alright的话那十个人和一个人那我觉得,philosophy,more
因为都是呃right做都是do right thing的,philosophy,more
如果if  this question makes sense的话我觉得应该会需要在不同的condition条件下去  考虑这个问题,philosophy,more
哦i我明白i understand so,philosophy,more
so如果在这种情况比如说那个one那个one one person可能是一个general或者比较,philosophy,more
比较productive或者比较smart people然后ten people可能是那些比较ordinary people和common people,philosophy,more
save那个important people然后来kill十个,philosophy,more
ok然后what do you think the meaning of life,philosophy,more
meaning of life其实,philosophy,more
我们a lot就是包括jack mikethat's uh涉及其中就讨论九九六的问题,philosophy,more
就是说whether we should work for six days from nine am toninep m,philosophy,more
meaning of life的问题,philosophy,more
呃我觉得我们需要给people给给给common people一些opportunity choose their life,philosophy,more
就是因为有些人他们的meaning of goal并不一定是work就是有些人可能把work,philosophy,more
我实现我personal value的一个一种方式,philosophy,more
他们的goal或者他们的meaning of life可能并不是wok他们可能是是live或者是,philosophy,more
真的love你做的东西比如说你你很清楚就是你的你的work是work for yourself work,philosophy,more
呃你你是realize your value的一个realize your dream的方式所以,philosophy,more
你现在其实play是为了是因为你earn是因为你你挣得  you you earn it,philosophy,more
你现在work hard是为了future的better life所以,philosophy,more
我的那个life um meaning of life是说be some who deserved to be loved是因为,philosophy,more
然后别人对我们的评价比较um objective所以当,philosophy,more
当你得到most of people的respect的时候其实就证明就是其实就是在说,philosophy,more
一种给我feedback的一种方式就证明我we are I am becoming a better person,philosophy,more
就是得到self satisfaction就是说我我自己我对自己其实满意的因为,philosophy,more
可能得可能会交到更多的朋友可能会生活的更好所以我觉得我现在定义的这个meaning of life就是这个,philosophy,more
我之前以前想过这个问题就非常的伤心因为我发现就是life is meaningless,philosophy,more
meaning of life就是说,philosophy,more
这样的话when you get old,philosophy,more
悲观so sad,philosophy,more
meaning of life是不一样的,philosophy,more
等于说这时候人的这个meaning of life可能又不一样,philosophy,more
我认为还是要找一个meaning of life,philosophy,more
but in end大家都会die,philosophy,more
所以为什么why why we need to live呢,philosophy,more
首先我们我们希望make the assumption that we我们不能die out,philosophy,more
show our respect to ourselves and the我们需要珍惜我们的生命所以我们不能够死,philosophy,more
而且这个goal必须是long term,philosophy,more
你的如果只是说边边边看边走或者说我们我们下次也也一样的所以我们需要work hard,philosophy,more
对但是你我觉得这个这个这个这个goal这个goal就是这个meaning还不够不够大因为我们需要定义meaning of life,philosophy,more
对我觉得所以我觉得meaning of life要,philosophy,more
思维吧或者说thought一直要去思考think about the problem,philosophy,more
然后more slowly to you你可以,philosophy,more
就是你可以再到呃a temporary one,philosophy,more
whether我我们是不是要换until you find the the the real one you,philosophy,more
明确你where are you going否则的话你其实就是,philosophy,more
而如果你有feedback你知道这个是negative的那你就会improve it,philosophy,more
对否则的话你没有feedback negative的话没有negative reward的话,philosophy,more
不知道love and pace吧哈哈,sports,more
对我其实非常喜欢hiking就是我之前刚来香港的时候我们会有一个orientation week然后呢就教大家怎么在香港玩,sports,more
四年在香港走了所有的hiking troll但是是不可能的然后但我给你推荐一个就是你知道,sports,more
嗯太平山那边嘛没有去过吗就是港大那边从那个Hong Kong U的后山有一个那个爬山的径可以直接上到太平山上面,sports,more
那个坐小巴去坐mini bus去 ,sports,more
so the name of the mountain I forgot but对但是那个地方叫做大潭水塘,sports,more
但是我现在听说seventy percent那个就是我们的这个drinking water都是from Guangzhou,sports,more
但是我是跟我朋友就是自己那个就是去那种rental company然后去去租他的那些设备,sports,more
呃not very expensive啦就是几几百几百块,sports,more
那你除了这个hiking然后你刚才说swimming你有去过学校的那个swimming pool吗,sports,more
啊就pay extra attention,sports,more
而且应该也是因为new open,sports,more
然后呢它有一些tennis court会在那个海边嘛对那边的就几乎没有人反而是LSK这边就定了很多,sports,more
it's like we are living in a二次元世界we are made by someone,philosophy,more
the黑镜黑镜got one  episode like this,philosophy,more
is it黑镜,philosophy,more
yeah黑镜got one episode that's the,philosophy,more
two a couple呃对one couple,philosophy,more
uh is that黑镜,philosophy,more
maybe this is us呃我们住在别人的refrigerator,philosophy,more
对I think呃I think,philosophy,more
自由意志in the,philosophy,more
呃society里面然后让它cater to the needs of the society,philosophy,more
when i see freedom我就想到了那个,philosophy,more
i don't know勇敢的心,philosophy,more
这是i think it's like,philosophy,more
first of all it's like human rights就是,philosophy,more
又可以工作也可以去做一些house wife but it's according to their will,philosophy,more
so i think freedom is the give you is to给你一个空间去选择给你一个自由的空间去选,philosophy,more
我how do you define就是自由这个东西,philosophy,more
就是如果说自由就像我we have talked talked about it's like,philosophy,more
呃under the society and this whole system我觉得这个freedom是可以是available的是,philosophy,more
是feasible in the future,philosophy,more
呃但是如果you you are talking about absolute freedom i don't think it's possible,philosophy,more
changing就是随着社会的发展the moral system is also developing,philosophy,more
yeah just like have the ability to do everything i want and就是,philosophy,more
可能首先让我们这个阶段要实现的就是Financial Freedom就是财务自由,philosophy,more
然后and may be in the next stage we can realize other freedom,philosophy,more
就是有其他的能力去做一些想做的事情and to do something meaningful to,philosophy,more
to自己and社会and the maybe anything,philosophy,more
yeah we are know我们都是唯物主义者,philosophy,more
Maybe you can find soul like differently就是可能是一个,philosophy,more
yes思想like mind,philosophy,more
soul is就是,philosophy,more
we could know that's until我们死了,philosophy,more
you know it's like呃,philosophy,more
the earth is having some kind of force就是and人们就会受这个force的影响,philosophy,more
it's a content number like九点八,philosophy,more
嗯yeah yeah yeah,philosophy,more
选择就是我们有很多有很多选择的方向and maybe different directions leads to a,philosophy,more
在一个重大的point然后你做了一个different choice,philosophy,more
第二次玩you are in another one,philosophy,more
听起来有点像听起来有点像black mirror最后一步那个可以做选择的那个,philosophy,more
definition is the parallel就是parallel就是两个不可以相交嘛,philosophy,more
物理学家I I forgot,philosophy,more
就是至少我们不能wecan't proved that,philosophy,more
like you have someone you admire嗯就是有一个人活成了,philosophy,more
就是你看到一个人他活成了你想活的样子and you are just admire him,philosophy,more
it's depends on different people就是每个人有不一样的喜欢的点because,philosophy,more
嗯give back,philosophy,more
单纯一些I don't think peoplecan do anything for her lover for or for for his lover,philosophy,more
no  you can't say that that's就是也不能说的那么物质but it's like互利共赢的一个关系就是,philosophy,more
我欣赏你你欣赏我and we are together and we are trying to,philosophy,more
get bet就是一起变成更好的人but not like I'mdoing things for you,philosophy,more
我我做事情为你就是it's like我愿意的but,philosophy,more
呃some of the,sports,more
但是有的可能是more about team work,sports,more
你girls also uh good at other things所以我觉得如果是类似于这样的项目的话其实,sports,more
that's okay就就就这样的team是okay的嗯,sports,more
physically more demanding所以会更累然后更累就是更难吧,sports,more
running from one end to the another end is like很久然后很累所以我就,sports,more
不知道说什么but then if I need to like voice out my opinion it really depends on how much,sports,more
政府想support or not然后我觉得是未来的二十年嘛,sports,more
因为because sports especial World Cup is becoming more and more competitive in a sense that,sports,more
and that the way one way to obtain these very good image is through winning the sports game and World Cup is one of the sports came along with the Olympics right所以我觉得,sports,more
对so as long as the government is  is willing to support and like,sports,more
get those like天才out of the school,sports,more
ok呃I I I just one uh add one point因为,sports,more
football international team呃competition,sports,more
科学的培养体系it's like,sports,more
你会了之后但是you just hate it,sports,more
那就完蛋了所以我觉得有就是even if government to want to do this,sports,more
呃I think,sports,more
呃呃 you you need to do,sports,more
sports sports这个里面我觉得,sports,more
没有必要非要强行地把它放在一起it can be different it can be,sports,more
这这这呃as important as sports but,sports,more
就是一个connection between those two might be,sports,more
嗯let's move on to a next question cause I  same opinion,sports,more
特殊特殊人的Olympics for example ,sports,more
人们like一般观众or public对这些活动的interest不是那么高,sports,more
所以我觉得  and difficulties of continuing this every year make us Olympic the whole nation the whole globe is like,sports,more
it's good that我们,sports,more
我们给这些人个chance to let show their talent,sports,more
这导致我完全没有办法说我也获得一个Olympic maybe champion的这个,sports,more
真的真的我我那个高中的时候每天跳了三千个然后一个月之后我i lost,sports,more
每天就跳对one month三千到四千个,sports,more
啊好吧好吧是你it's your own problem ok,sports,more
这个对我觉得这种closed form,technology,more
data processing嘛差不多,technology,more
我估计嗯to be  well,technology,more
i have a lot of class in machine learning所以,technology,more
这是neural network,technology,more
neural network什么的,technology,more
那o ocr那种已经做出来了我们就没有,technology,more
block chain的 ,technology,more
我想知道的是block chain在你们那儿,technology,more
据我据我所学到的关于block chain的,technology,more
他们肯定是是要collecting your data,technology,more
但是如果你不让他collect他就无法为你制定more personal,technology,more
用credit card那么方便,technology,more
它需要assign in how many boys how many girls the ratio should be巴拉巴拉,sports,more
嗯which sport is the best which one is the most challenging,sports,more
you know what I mean 就是,sports,more
不是说所有人都说呀win win weneed to win,sports,more
we want them we we want to do win the first prize of 巴拉巴拉,sports,more
所有人都觉得哎it doesn't matter just  who cares,sports,more
感觉就是how to say Chinese soccer ball team has already,sports,more
i agree因为怎么说就是其实中国人自古就是比较中庸的就是没有说特别强的那种竞争的那种,sports,more
哦吼吼吼i think,sports,more
对然后我觉得实际上瑜伽本身是不减肥的就是你知道你知道有一种yoga叫hot yoga,sports,more
就是you you will do yoga in a very hot room making a sweet march and就是这种它是可以减肥的对我来说,sports,more
也对确实但他们就是有的人讲说说了for diet maybe seventy percent is,sports,more
其实control your what do you eatorhow much you eat,sports,more
呃do you think man can do better sports than women,sports,more
呃if if those sports requires much,sports,more
我也不知道就是就是像我ex boyfriend他的屁股就很翘,sports,more
就是the structure of boy就是他们那那一块儿会直接把他们的屁股托起来或者说,sports,more
说屁股那里就是肌肉力量比较大就像比如说像black man,sports,more
诶那你们你一般健身的话是有do you那个if you want to,sports,more
how to say健身,sports,more
呃before we can reach the playground we need to go downstair,sports,more
但是比如说如果在你一个比如说you're extremely  sleeping或者是你觉得,sports,more
What do you need is to sleep more然后在你sleep之后,sports,more
yeah呃to be honest when we need to stay up late maybe for a single day,sports,more
哦the assignment so we don't have a time to do exercise,sports,more
所以他们也是可能有一定的free will的虽然可能是在游机游戏设计者的那个脑中,philosophy,more
所以我们其实是有一个完全的free will吗,philosophy,more
嗯如果我们没有完全的free will,philosophy,more
呃sometimes you are feel like you are control by,philosophy,more
嗯naturally  like that but I would not say,philosophy,more
嗯it's like for example,philosophy,more
嗯I don't know about,philosophy,more
and the至于最后考试的结果那只不过是一个,philosophy,more
you can你可以控制你自己,philosophy,more
在在做题的时候做这道题这道题做不做什么什么样整个过程你还是在control yourself,philosophy,more
你要in some inevitable destructive is,philosophy,more
嗯so in this case you,philosophy,more
呃it is like a,philosophy,more
我说可能这个free will更有一个时间上的问题,philosophy,more
oh isee呃,philosophy,more
呃I I see,philosophy,more
呃you should do something that not,philosophy,more
that's what we called道德,philosophy,more
所以we should like not just,philosophy,more
so so for example你如果,philosophy,more
我呃another place to to do this,philosophy,more
so a moral system has to be established to say嗯,philosophy,more
来to maintain the good order offer society ,philosophy,more
you are control buy the the rule by the法律,philosophy,more
呃we are we are control by yourself of course but we also need to understand something we cannot do,philosophy,more
it is also like we control ourselves我们控制自己不要随地吐痰,philosophy,more
不要pee around,philosophy,more
so for宗教来说,philosophy,more
呃or maybe you can it it is also a thing to motivate yourself to,philosophy,more
呃sense may can  other things maybe you don't care about,philosophy,more
我我完全相信这些但我完全也可以理解一些some people believe in god,philosophy,more
in the other thing like I may have mention in my personal belief is that like in the view religion itself在宗教的观点看来,philosophy,more
and it's like the exercise some kind of belief or in a religious term called faith信心,philosophy,more
嗯for now like I am afraid may not,philosophy,more
好next session我们聊一聊关于freedom的话题吧,philosophy,more
比如说we we we we talk together,philosophy,more
in a room or呃,philosophy,more
on playground虽然说,philosophy,more
呃you cannot,philosophy,more
呃就比如说一个比如说美国的学校吧他们为了所谓的叫discrimination original,philosophy,more
另外  呃in quality的问题所以我觉得,philosophy,more
就是自由就是在under under呃在法律环境下面的话其实他们并没有任何  任何的law可是这样一种,philosophy,more
所以我的我的我的I what I mean is就是说,philosophy,more
冲突的时候which side we should we should stand就我们应该怎么样去做这个选择,philosophy,more
I think我觉得human have a soul,philosophy,more
比如说当我们dream的时候我们会有一个imagine world在这个imagine world你可以do whatever you want,philosophy,more
那我觉得这是就灵魂它需要有一个somewhere to live,philosophy,more
因为我们作为一个nature people我们作为一个well educated citizen我们在这个world在这个real world里面需要obey很多rules,philosophy,more
我们需要有一个地方我们可以cheer up我们可以,philosophy,more
I think呃我不觉得我不知道我,philosophy,more
我觉得humans and animals um both have soul,philosophy,more
animals they have a soul呃嗯他们也也懂就是哦别的别的物种,philosophy,more
is the most important purpose in life is happiness你觉得世界上最重要的你来这个世界最重要的目的是为了开心吗为什么,philosophy,more
um my name is王欣怡欣怡is very happiness so my my father um my parents,philosophy,more
呃they want me to be happy everyday 嗯但是呢我自己,philosophy,more
一种安全感吧然后到后面我呃when I grow up我觉得比如说company陪伴啊比如说love,philosophy,more
嗯比如说刚才我们提到一些education的话题包括一些technology像呃像multi media这些都是陪伴我的对我来说意义很重大的东西,philosophy,more
