2435,嗯 let's move on to a next question cause I same opinion,IJ AD VV P P NN NN NN NN PN VV NN,more,,,,sports,train,8733
2436,特殊 特殊 人 的 Olympics for example,JJ JJ NN DEG NN P NN,more,,,,sports,train,8737
2437,人们 like 一般 观众 or public 对 这些 活动 的 interest 不 是 那么 高,NN VV JJ NN CC JJ P DT NN DEG NN AD VC AD VA,more,,,,sports,train,8743
2438,所以 我 觉得 and difficulties of continuing this every year make us Olympic the whole nation the whole globe is like,AD PN VV CC VV P URL PN AD AD VV AD JJ DT NN NN DT NN VV VC VV,more,,,,sports,train,8744
2439,it's good that 我们,JJ NN CS PN,more,,,,sports,train,8749
2440,我们 给 这些 人 个 chance to let show their talent,PN P DT NN M VV P VV NN NN NN,more,,,,sports,train,8750
2441,嗯 我 是 觉得 我 就 从 这些 player 的 角度 来说 我 觉得 有 这么 一 个 东西 其实 还 挺 好 的 就是 就是 就是 因为 大家 对于 这 件 事情 非常 的 认可,IJ PN VC VV PN AD P DT NN DEG NN LC PN VV VE JJ CD M NN AD AD AD VA DEC AD AD AD P PN P DT M NN AD DEV VV,1,['player'],[8],['NN'],sports,train,8754
2442,这 导致 我 完全 没有 办法 说 我 也 获得 一 个 Olympic maybe champion 的 这个,PN VV PN AD VE NN VV PN AD VV CD M NN AD VV DEC DT,more,,,,sports,train,8756
2443,yeah 那 那 那 如果 我们 给 他们 这样 一 个 机会 的话 我 觉得 还是 挺 好的,NR AD AD AD CS PN P PN JJ CD M NN SP PN VV AD AD VV,1,['yeah'],[0],['NR'],sports,train,8761
2444,yesso 那 我 觉得 其实,NR AD PN VV AD,1,['yesso'],[0],['NR'],sports,train,8767
2445,就是 就 它 就 是 一 个 Olympic 也好 它 就 是 一 个 另外 的,AD AD PN AD VC CD M NN AD PN AD VC CD M JJ DEG,1,['Olympic'],[7],['NN'],sports,train,8768
2446,就是 非常 有 reputation 的 一 个 名字 也好 我 觉得 其实 都 可以 其实 就 像 我们,AD AD VE NN DEC CD M NN AD PN VV AD AD VV AD AD VV PN,1,['reputation'],[3],['NN'],sports,train,8769
2447,你 说 头脑 的 Olympic 也 是 一 样 的 就是 我们 在 用 Olympic 这个 brand,PN VV NN DEC NR AD VC CD M DEG AD PN AD P NR DT NN,3,"['Olympic', 'Olympic', 'brand']","[4, 14, 16]","['NR', 'NR', 'NN']",sports,train,8770
2448,你 体能 很好 然后 maybe 你 有 其他 的 强强 项 那 就 是 大家 都 知道 Olympic 这个 这个 这个 brand 下面 可以 做 一些,PN NN JJ AD AD PN VE DT DEG AD M PN AD VC PN AD VV NR DT DT DT NN NN VV VV CD,3,"['maybe', 'Olympic', 'brand']","[4, 17, 21]","['AD', 'NR', 'NN']",sports,train,8779
2449,全球性 的 活动 来 其实 我 觉得 也挺 好像 像 什么 物理 也 是 Olympic 数学 也 是 Olympic,JJ DEG NN MSP AD PN VV AD AD VV DT NN AD VC NR NN AD VC NR,2,"['Olympic', 'Olympic']","[14, 18]","['NR', 'NR']",sports,train,8780
2450,真的 真的 我 我 那个 高中 的 时候 每 天 跳 了 三千 个 然后 一 个 月 之后 我 i lost,AD AD PN PN DT NN DEC NN DT M VV AS CD M AD CD M NN LC PN VV NN,more,,,,sports,train,8786
2451,每 天 就 跳 对 one month 三千 到 四千 个,DT M AD VV P NN NN CD CC CD M,more,,,,sports,train,8789
2452,but 我 听说,AD PN VV,1,['but'],[0],['AD'],sports,train,8791
2453,啊 但是 这个 问题 是 diet 嘛,IJ AD DT NN VC NN SP,1,['diet'],[5],['NN'],sports,train,8794
2454,啊 好 吧 好吧 是 你 it's your own problem ok,IJ VA SP VA VC PN VV PN AD VV NN,more,,,,sports,train,8808
2455,目前 来说 还是 Mac,NT LC AD VV,1,['Mac'],[3],['VV'],technology,train,8822
2456,ipad 可以 做 扩展 屏幕,NN VV VV NN NN,1,['ipad'],[0],['NN'],technology,train,8829
2457,作为 Mac 的 扩展 屏幕,P NR DEG NN NN,1,['Mac'],[1],['NR'],technology,train,8830
2458,这个 对 我 觉得 这 种 closed form,PN P PN VV DT M VV NN,more,,,,technology,train,8833
2459,的 这 种 idea 很 棒 所以 嗯 我 也 算是 一 名,DEG DT M NN AD JJ AD IJ PN AD VV CD M,1,['idea'],[3],['NN'],technology,train,8834
2460,做 syntax 的 东西,VV NR DEC NN,1,['syntax'],[1],['NR'],technology,train,8842
2461,啊 所以 你 学的 还 基本上 都 是 全 business 的 knowledge,IJ AD PN AD AD AD AD VC DT NR DEG NN,2,"['business', 'knowledge']","[9, 11]","['NR', 'NN']",technology,train,8844
2462,data processing 嘛 差不多,NN VV SP VA,more,,,,technology,train,8846
2463,那 你们 这个 不 是 ai 吗,AD PN PN AD VC NN SP,1,['ai'],[5],['NN'],technology,train,8847
2464,你们 一般 prediction 什么 东西,PN AD VV DT NN,1,['prediction'],[2],['VV'],technology,train,8848
2465,我 估计 嗯 to be well,PN VV IJ P JJ NN,more,,,,technology,train,8859
2466,i have a lot of class in machine learning 所以,NN NN NN NN P NR P NN NN AD,more,,,,technology,train,8864
2467,这 是 neural network,PN VC JJ NN,more,,,,technology,train,8869
2468,嗯 我 应该 明白 我们 虽然 我们 都 会 用到 那些 model,IJ PN VV VV PN CS PN AD VV VV DT NN,1,['model'],[11],['NN'],technology,train,8874
2469,neural network 什么的,JJ NN PN,more,,,,technology,train,8875
2470,但是 我们 的 区别 就是 就是 business 跟 我们 做 engineering 的 区别 可能 还是 在 data,AD PN DEG NN AD AD NN P PN VV JJ DEG NN AD AD VV NN,3,"['business', 'engineering', 'data']","[6, 10, 16]","['NN', 'JJ', 'NN']",technology,train,8876
2471,你们 的 data 可能 是 那种,PN DEG NN AD VC NN,1,['data'],[2],['NN'],technology,train,8877
2472,呃要 用于 商业 分析 的 data,AD VV NN NN DEG NN,1,['data'],[5],['NN'],technology,train,8878
2473,我们 的 data 是 那种,PN DEG NN VC VA,1,['data'],[2],['NN'],technology,train,8879
2474,那 o ocr 那 种 已经 做 出来 了 我们 就 没有,AD NN NN DT M AD VV VV AS PN AD VE,more,,,,technology,train,8882
2475,因为 在 syntax 这 一 块 还 有 一 个 还有 一 个 领域 叫做,P P NR DT CD M AD VE CD M CC CD M NN VV,1,['syntax'],[2],['NR'],technology,train,8885
2476,block chain 的,NR NR DEG,more,,,,technology,train,8886
2477,我 想 知道 的 是 block chain 在 你们 那儿,PN VV VV DEC VC JJ NR P PN PN,more,,,,technology,train,8887
2478,你们 知不 知道 这个 project 或者 知道 这 里面 是 干嘛 的,PN AD VV DT NN CC VV PN NN VC VV SP,1,['project'],[4],['NN'],technology,train,8891
2479,据 我 据 我 所 学到 的 关于 block chain 的,P PN P PN MSP VV DEC P NR NR DEG,more,,,,technology,train,8897
2480,他 要 的 哪 他 要 探索 需要 哪些 text 我 都,PN VV DEC SP PN VV VV VV PN VV PN AD,1,['text'],[9],['VV'],technology,train,8902
2481,privacy 啊 你 有 没 有 考虑 过 呢,NR SP PN VE AD VE VV AS SP,1,['privacy'],[0],['NR'],technology,train,8905
2482,如果 你 需要 那些 robot,CS PN VV DT NN,1,['robot'],[4],['NN'],technology,train,8910
2483,他们 肯定 是 是 要 collecting your data,PN AD VC VC VV VV PN NN,more,,,,technology,train,8912
2484,但是 这些 data 一旦 被 他们 collecting 之后,AD DT NN CS LB PN VV LC,2,"['data', 'collecting']","[2, 6]","['NN', 'VV']",technology,train,8915
2485,就是 你 的 privacy,AD PN DEG NN,1,['privacy'],[3],['NN'],technology,train,8916
2486,如果 你 愿意 让 他 collect,CS PN VV VV PN NN,1,['collect'],[5],['NN'],technology,train,8921
2487,你 就 相当于 把 自己 的 privacy 交给 他 了,PN AD VV BA PN DEG NN VV PN SP,1,['privacy'],[6],['NN'],technology,train,8922
2488,但是 如果 你 不 让 他 collect 他 就 无法 为 你 制定 more personal,AD CS PN AD VV PN VV PN AD AD P PN VV NN NN,more,,,,technology,train,8923
2489,的 一些 service,DEG CD NN,1,['service'],[2],['NN'],technology,train,8924
2490,AI 这些 AI 背后 技术 的 大厂 做 一 个,NR DT NN NN NN DEG NN VV CD M,2,"['AI', 'AI']","[0, 2]","['NR', 'NN']",technology,train,8926
2491,为什么 香港人 用 alipay 比较 少 没 不 那么 主流,AD NN P NN AD AD AD AD AD NN,1,['alipay'],[3],['NN'],technology,train,8935
2492,用 credit card 那么 方便,P NN VV AD VA,more,,,,technology,train,8938
2493,可能 他们 还 考虑 到 自己 的 privacy,VV PN AD VV VV PN DEG NN,1,['privacy'],[7],['NN'],technology,train,8939
2494,不管 是 不 是 同 一 个 性别 的 我 觉得 都 都 ok,AD VC AD VC DT CD M NN DEG PN VV AD AD VV,1,['ok'],[13],['VV'],sports,train,8955
2495,但是 我 觉得 在 muscle 啊 strength 方面 可能,AD PN VV P NN SP NN NN VV,2,"['muscle', 'strength']","[4, 6]","['NN', 'NN']",sports,train,8956
2496,对 但是 比如说 有一些 sports 是 相对来说 比较 比较 静态 的 比如说,P AD AD AD NR VC AD AD AD JJ DEG AD,1,['sports'],[4],['NR'],sports,train,8958
2497,对 比如说 chess,P AD NR,1,['chess'],[2],['NR'],sports,train,8960
2498,这 种 东西 它 虽然 也 是 sports 还有 就是 打 麻将,DT M NN PN CS AD VC NR CC AD VV NN,1,['sports'],[7],['NR'],sports,train,8961
2499,对 我 觉得 只要 不 是 太 competitive 的 其实 就 都 ok 了,P PN VV CS AD VC AD VV DEC AD AD AD VV AS,2,"['competitive', 'ok']","[7, 12]","['VV', 'VV']",sports,train,8964
2500,它 需要 assign in how many boys how many girls the ratio should be 巴拉 巴拉,PN VV VV P NN JJ NN NN JJ NN DT NN NN NN NR NR,more,,,,sports,train,8969
2501,嗯 which sport is the best which one is the most challenging,IJ NN NN VC DT JJ NN NN VC DT URL URL,more,,,,sports,train,8973
2502,嗯 un,IJ NN,1,['un'],[1],['NN'],sports,train,8980
2503,you know what I mean 就是,PN VV PN PN VV AD,more,,,,sports,train,8986
2504,不是说 所有 人 都 说 呀 win win weneed to win,AD DT NN AD VV SP NN NN VV P NR,more,,,,sports,train,8987
2505,we want them we we want to do win the first prize of 巴拉 巴拉,PN VV VV PN PN VV P VV NN DT NN NN P NR NR,more,,,,sports,train,8988
2506,所有 人 都 觉得 哎 it doesn't matter just who cares,DT NN AD VV IJ AD VV NN NN NN NN,more,,,,sports,train,8992
2507,感觉 就 是 how to say Chinese soccer ball team has already,NN AD VC VV P NR NN NN NN NN AD VV,more,,,,sports,train,8998
2508,嗯 哎 yeah,IJ IJ NN,1,['yeah'],[2],['NN'],sports,train,9000
2509,i agree 因为 怎么 说 就是 其实 中国人 自古 就是 比较 中庸 的 就是 没有 说 特别 强的 那 种 竞争 的 那种,NN NN P AD VV AD AD NN AD AD AD VA DEC AD AD VV AD VV DT M NN DEG NN,more,,,,sports,train,9001
2510,然后 其实 我们 现在 已经 很 佛 了 就是 大家 每个 人 都 很 佛 就 是 可能 不 太 会 care 这 方面 的 一些 问题,AD AD PN NT AD AD NN SP AD PN DT NN AD AD NN AD VC AD AD AD VV VV DT NN DEG CD NN,1,['care'],[21],['VV'],sports,train,9005
2511,哦 吼吼吼 i think,IJ NR NN NN,more,,,,sports,train,9020
2512,对 然后 我 觉得 实际上 瑜伽 本身 是 不 减肥 的 就 是 你 知道 你 知道 有 一 种 yoga 叫 hot yoga,P AD PN VV AD NN PN VC AD VV DEC AD VC PN VV PN VV VE CD M NN VV NN NN,more,,,,sports,train,9034
2513,就是 you you will do yoga in a very hot room making a sweet march and 就是 这 种 它 是 可以 减肥 的 对我来说,AD PN PN VV VV NR P NN NN AD VV JJ NN NN NN CC AD DT M PN VC VV VV DEC NN,more,,,,sports,train,9036
2514,但是 我 觉得 swimming 确实 好像 说 蛮 减肥 但是 我 我,AD PN VV NR AD AD VV AD VV AD PN PN,1,['swimming'],[3],['NR'],sports,train,9037
2515,然后 如果说 你 一直 在 游 的 话 好像 说 是 可以 减肥 的 就 减 某些 部分 的 肥肉 因为 我 有 个 有 个 friend 他 就是 他 就是 通过 游泳 然后 瘦 了 很多 对,AD CS PN AD AD VV DEC NN AD VV VC VV VV DEC AD VV DT NN DEG NN P PN VE M VE M VV PN AD PN AD P NN AD VV AS CD VA,1,['friend'],[26],['VV'],sports,train,9040
2516,但是 其实 除了 游泳 以外 就 是 除了 除了 做 这些 sports 其实 更 重要 的 还是 饮食 方面 的 问题,AD AD P NN LC AD VC P P VV DT NN AD AD VA DEC CC NN NN DEG NN,1,['sports'],[11],['NN'],sports,train,9041
2517,因为 其实 如果 你 做 了 很多 sport 然后 你 就 回去 吃 很多 东西 的话 其实 也 没有 太 大 的 用,P AD CS PN VV AS CD NN AD PN AD VV VV CD NN SP AD AD VE AD VA DEC NN,1,['sport'],[7],['NN'],sports,train,9042
2518,也 对 确实 但 他们 就是 有的 人讲 说说 了 for diet maybe seventy percent is,AD P AD AD PN AD DT NN VV AS P NN AD NN NN VC,more,,,,sports,train,9047
2519,其实 control your what do you eatorhow much you eat,AD NR PN PN VV PN JJ NN PN VV,more,,,,sports,train,9048
2520,对 我 就是 很 喜欢 我 特 尤其是 晚饭 特别 喜欢 那 种 高糖 高 热量 的 东西 比如说 McDonald 这 种 东西,P PN AD AD VV PN AD AD NN AD VV DT M NN JJ NN DEG NN AD NR DT M NN,1,['McDonald'],[19],['NR'],sports,train,9058
2521,然后 你 知道 人 一 没有 那 种 stressed 就 会 吃 很多 然后 就 很 容易 变胖,AD PN VV NN CD VE DT M NN AD VV VV CD AD AD AD AD VV,1,['stressed'],[8],['NN'],sports,train,9063
2522,呃 do you think man can do better sports than women,IJ VV PN NN NN VV VV NN NN NN NN,more,,,,sports,train,9068
2523,呃 if if those sports requires much,IJ VV JJ NN NN NN NN,more,,,,sports,train,9070
2524,但是 吧 我 觉得 还 挺 难 但是 就 怎么 说 呢 我 说 这 是 我 觉得 是 一 个 average 的 一 个 状态 就是 你 肯定 会 有 女生,AD SP PN VV AD AD AD AD AD AD VV SP PN VV PN VC PN VV VC CD M JJ DEG CD M NN AD PN AD VV VE NN,1,['average'],[21],['JJ'],sports,train,9073
2525,某些 男生 强 的 时候 就 是 但是 可能 那些 那个 那些 女生 都 属于 那 种 outstanding 一枝独秀 的 那 种 感觉 他 不 能 说 是 average 都 比 那个,DT NN VA DEC NN AD VC AD AD DT DT DT NN AD VV DT M NN VV DEC DT M VV PN AD VV VV VC NR AD VV DT,2,"['outstanding', 'average']","[17, 28]","['NN', 'NR']",sports,train,9075
2526,像 我 觉得 像 tennis 那个 部分 就 是 我 不 知道 你 知不知道 有 有 一 个,P PN VV P NN DT NN AD VC PN AD VV PN VV VE VE CD M,1,['tennis'],[4],['NN'],sports,train,9077
2527,美国 有 一 个 双胞胎 运动员 是 那个 大大 v和小v 嘛,NR VE CD M NN NN VC DT AD VV SP,2,[],[],[],sports,train,9078
2528,那 我 有 听 过小v 的 名字,AD PN VE VV NN DEG NN,1,[],[],[],sports,train,9079
2529,就是 不 是 每 个 人 都 可以 成为 大 v小v,AD AD VC DT M NN AD VV VV JJ NN,2,[],[],[],sports,train,9083
2530,我 也 不 知道 就是 就是 像 我 ex boyfriend 他 的 屁股 就 很 翘,PN AD AD VV AD AD P PN VV NR PN DEG NN AD AD VA,more,,,,sports,train,9089
2531,就是 the structure of boy 就是 他们 那 那 一 块儿 会 直接 把 他们 的 屁股 托 起来 或者说,AD DT NN P NR AD PN DT DT CD M VV AD BA PN DEG NN VV VV CC,more,,,,sports,train,9091
2532,就是 我 也 不 知道 反正 是 反正 我 之前 有 看 过 一 个 像 那 种 talk 啊,AD PN AD AD VV AD VC AD PN AD VE VV AS CD M P DT M NN SP,1,['talk'],[18],['NN'],sports,train,9093
2533,说 屁股 那里 就是 肌肉 力量 比较 大 就像 比如说 像 black man,VV NN PN AD NN NN AD VA AD AD P NN NN,more,,,,sports,train,9095
2534,或者是 那 种 jump 类 的 就是 都会 比较 天生 比较 有 优势 就是 因为,CC DT M NN NN DEG AD NN AD VA AD VE NN AD P,1,['jump'],[3],['NN'],sports,train,9097
2535,然后 可能 就 做 这样 一 个 action 的话 好像 说 会 屁股 会 翘 一点,AD AD AD VV JJ CD M NN SP AD VV VV NN VV VA AD,1,['action'],[7],['NN'],sports,train,9104
2536,诶 那 你们 你 一般 健身 的话 是 有 do you 那个 if you want to,IJ AD PN PN JJ NN SP VC VE VV PN DT NN PN VV P,more,,,,sports,train,9118
2537,how to say 健身,VV P NR NN,more,,,,sports,train,9119
2538,呃 before we can reach the playground we need to go downstair,IJ NN PN VV VV DT NN PN VV P VV NN,more,,,,sports,train,9123
2539,然后 那个 那个 那个 stair 其实 我 不 是 很 喜欢 因为 它 太 高 了,AD DT DT DT NN AD PN AD VC AD VV P PN AD VA SP,1,['stair'],[4],['NN'],sports,train,9126
2540,有 点 那 种 terrify 的 感觉 所以 就 不 是 很 喜欢,VE M DT M NN DEG NN AD AD AD VC AD VV,1,['terrify'],[4],['NN'],sports,train,9128
2541,但是 就是 因为 这 条 阶梯 的 问题 所以 就 没有 去 playground 这样子,AD AD P DT M NN DEG NN AD AD AD VV NN VA,1,['playground'],[12],['NN'],sports,train,9131
2542,哦 我 觉得 assay 真的 太 折磨 人 了,IJ PN VV NR AD AD VV NN SP,1,['assay'],[3],['NR'],sports,train,9144
2543,但是 比如说 如果 在 你 一 个 比如说 you're extremely sleeping 或者是 你 觉得,AD AD CS P PN CD M AD JJ JJ NN CC PN VV,more,,,,sports,train,9149
2544,猝死 啊 这 种 增加 这 种 risk,VV SP DT M VV DT M NN,1,['risk'],[7],['NN'],sports,train,9155
2545,What do you need is to sleep more 然后 在 你 sleep 之后,PN VV PN VV VC P NR NN AD P PN NN LC,more,,,,sports,train,9157
2546,tire 的 非常 sleepy 的 时候 去 锻炼 这样 反而 不好,NN DEG AD VA DEC NN VV VV AD AD AD,2,"['tire', 'sleepy']","[0, 3]","['NN', 'VA']",sports,train,9159
2547,yeah 呃 to be honest when we need to stay up late maybe for a single day,NR IJ P JJ NN NN PN VV P NR AD VV AD P CD JJ NN,more,,,,sports,train,9160
2548,哦 the assignment so we don't have a time to do exercise,IJ DT NN NN PN VV NN NN VV P VV NR,more,,,,sports,train,9162
2549,so 嗯 这 怎么 说 呢 就是,NR IJ PN AD VV SP AD,1,['so'],[0],['NR'],sports,train,9163
2550,所以 他们 也 是 可能 有 一定 的 free will 的 虽然 可能 是 在 游机 游戏 设计者 的 那个 脑中,AD PN AD VC AD VE JJ DEG NN NN DEG CS VV VC P NN NN NN DEG DT NN,more,,,,philosophy,train,9204
2551,所以 我们 其实 是 有 一 个 完全 的 free will 吗,AD PN AD VC VE CD M JJ DEG NN NN SP,more,,,,philosophy,train,9205
2552,嗯 如果 我们 没有 完全 的 free will,IJ CS PN AD AD DEV VV NN,more,,,,philosophy,train,9206
2553,呃 sometimes you are feel like you are control by,IJ NN PN VC AD VV PN VC NN P,more,,,,philosophy,train,9208
2554,嗯 naturally like that but I would not say,IJ AD VV CS CC PN VV NN NN,more,,,,philosophy,train,9213
2555,嗯 it's like for example,IJ AD VV P NN,more,,,,philosophy,train,9227
2556,嗯 you,IJ PN,1,['you'],[1],['PN'],philosophy,train,9228
2557,嗯 I don't know about,IJ PN VV VV NR,more,,,,philosophy,train,9234
2558,so 在 第一 个 情况,NR P OD M NN,1,['so'],[0],['NR'],philosophy,train,9245
2559,and the 至于 最后 考试 的 结果 那 只不过 是 一 个,CC DT P JJ NN DEG NN DT AD VC CD M,more,,,,philosophy,train,9250
2560,you can 你 可以 控制 你自己,PN VV PN VV VV PN,more,,,,philosophy,train,9257
2561,在 在 做题 的 时候 做 这 道 题 这 道 题 做 不 做 什么 什么样 整个 过程 你 还是 在 control yourself,P P VV DEC NN VV DT M NN DT M NN VV AD VV DT JJ DT NN PN AD P NR NR,more,,,,philosophy,train,9258
2562,你 要 in some inevitable destructive is,PN VV P NN JJ NN VC,more,,,,philosophy,train,9270
2563,嗯 so in this case you,IJ NN P PN NN PN,more,,,,philosophy,train,9272
2564,呃 it is like a,IJ NN VC VV NN,more,,,,philosophy,train,9276
2565,这 就 是 不 能 control,PN AD VC AD VV VV,1,['control'],[5],['VV'],philosophy,train,9285
2566,我 说 可能 这个 free will 更 有 一 个 时间 上 的 问题,PN VV VV DT NN NN AD VE CD M NN LC DEG NN,more,,,,philosophy,train,9288
2567,因为 例如说 like,P AD VV,1,['like'],[2],['VV'],philosophy,train,9289
2568,or 道德 规范,CC NN VA,1,['or'],[0],['CC'],philosophy,train,9316
2569,oh isee 呃,AD NR SP,more,,,,philosophy,train,9319
2570,呃 now,IJ NN,1,['now'],[1],['NN'],philosophy,train,9320
2571,呃 I I see,IJ PN PN NN,more,,,,philosophy,train,9321
2572,呃 you should do something that not,IJ PN NN VV JJ CS VA,more,,,,philosophy,train,9323
2573,that's what we called 道德,AD PN PN VV NN,more,,,,philosophy,train,9324
2574,所以 we should like not just,AD PN AD VV JJ NN,more,,,,philosophy,train,9325
2575,so so for example 你 如果,NN NN P NN PN CS,more,,,,philosophy,train,9327
2576,我 呃 another place to to do this,PN IJ NN VV P P VV PN,more,,,,philosophy,train,9334
2577,so a moral system has to be established to say 嗯,NR CD JJ NN VV P JJ VV P NR IJ,more,,,,philosophy,train,9347
2578,来 to maintain the good order offer society,VV P NN DT NN NN NN NN,more,,,,philosophy,train,9348
2579,you are control buy the the rule by the 法律,PN VC JJ NN DT DT NN P DT NN,more,,,,philosophy,train,9353
2580,我 我 我 我们 像是 别人 游戏 里面 的 player 一样,PN PN PN PN VV NN NN NN DEG NN VA,1,['player'],[9],['NN'],philosophy,train,9358
2581,呃 we are we are control by yourself of course but we also need to understand something we cannot do,IJ PN VC PN VC JJ P NR P NR CC PN AD VV P JJ NN PN VV VV,more,,,,philosophy,train,9361
2582,it is also like we control ourselves 我们 控制 自己 不要 随地 吐痰,NN VC AD VV PN JJ NN PN VV PN AD AD VV,more,,,,philosophy,train,9362
2583,不要 pee around,AD VV NN,more,,,,philosophy,train,9363
2584,so for 宗教 来说,NN P NN LC,more,,,,philosophy,train,9393
2585,呃 or maybe you can it it is also a thing to motivate yourself to,IJ CC AD PN VV VV VV VC NR NN VV P JJ NN P,more,,,,philosophy,train,9414
2586,but 呃 but,AD IJ CC,2,"['but', 'but']","[0, 2]","['AD', 'CC']",philosophy,train,9420
2587,呃 sense may can other things maybe you don't care about,IJ NN NN VV NN NN AD PN VV VV NR,more,,,,philosophy,train,9421
2588,要么 有 science,AD VE NN,1,['science'],[2],['NN'],philosophy,train,9424
2589,我 我 完全 相信 这些 但 我 完全 也 可以 理解 一些 some people believe in god,PN PN AD VV DT AD PN AD AD VV VV CD NN NN NN P NN,more,,,,philosophy,train,9434
2590,in the other thing like I may have mention in my personal belief is that like in the view religion itself 在 宗教 的 观点 看来,P DT NN AD VV PN AD VV NN P NN JJ NN VC CS VV P DT NN NN NR P NN DEG NN VV,more,,,,philosophy,train,9441
2591,人 是 从 他 那里 去接 收到 一些 启示 或者 说用 更 能够 通俗 的话 说 启发 inspirations 之后,NN VC P PN PN VV VV CD NN CC VV AD VV VA SP VV VV NN LC,1,['inspirations'],[17],['NN'],philosophy,train,9444
2592,and it's like the exercise some kind of belief or in a religious term called faith 信心,CC AD VV DT JJ NN NN P VV CC P NN NN NN VV JJ NN,more,,,,philosophy,train,9448
2593,嗯 for now like I am afraid may not,IJ P NN VV PN VV NR NN NN,more,,,,philosophy,train,9456
2594,好 next session 我们 聊 一 聊 关于 freedom 的 话题 吧,JJ NN NN PN VV CD VV P NN DEG NN SP,more,,,,philosophy,train,9469
2595,呃 你 觉得 什么 是 freedom,IJ PN VV PN VC NN,1,['freedom'],[5],['NN'],philosophy,train,9471
2596,呃 freedom,IJ NN,1,['freedom'],[1],['NN'],philosophy,train,9473
2597,比如说 we we we we talk together,AD PN PN PN PN VV NN,more,,,,philosophy,train,9474
2598,呃 in,IJ P,1,['in'],[1],['P'],philosophy,train,9480
2599,in a room or 呃,P NN NN CC IJ,more,,,,philosophy,train,9481
2600,on playground 虽然说,P NN CS,more,,,,philosophy,train,9482
2601,可能 playground 那个 空间 大一点 但是 我 觉得 跟 你 的 内心 感受 是 不 一样 的,AD NN DT NN AD AD PN VV P PN DEG NN NN VC AD VA SP,1,['playground'],[1],['NN'],philosophy,train,9483
2602,我 觉得 这 就 是 freedom,PN VV PN AD VC NN,1,['freedom'],[5],['NN'],philosophy,train,9488
2603,freedom 比如说,NR AD,1,['freedom'],[0],['NR'],philosophy,train,9491
2604,no 这,NN DT,1,['no'],[0],['NN'],philosophy,train,9493
2605,呃 法律 啊 law 允许 的 范围 内 还有,IJ NN SP AD VV DEC NN LC CC,1,['law'],[3],['AD'],philosophy,train,9497
2606,呃 you cannot,IJ PN VV,more,,,,philosophy,train,9498
2607,你 不 能 去 违背 这个 世界 的 nature 这个 世界 的 rational,PN AD VV VV VV DT NN DEG NN DT NN DEG NN,2,"['nature', 'rational']","[8, 12]","['NN', 'NN']",philosophy,train,9502
2608,我 其实 对 这个 问题 不 是 很 很 clear,PN AD P DT NN AD VC AD AD VA,1,['clear'],[9],['VA'],philosophy,train,9512
2609,比如 我 因为 我 有 很多 很多 confusion,AD PN P PN VE CD CD NN,1,['confusion'],[7],['NN'],philosophy,train,9514
2610,一 个 比较 比较 easy 的 限制 就是说 我们 把 它 只要 在,CD M AD AD VA DEC NN AD PN BA PN AD AD,1,['easy'],[4],['VA'],philosophy,train,9518
2611,law 里面 的 你 都 可以 做 然后 在 law 外面 的 不可以 做,NN NN DEG PN AD VV VV AD P NN NN DEG NN VV,2,"['law', 'law']","[0, 9]","['NN', 'NN']",philosophy,train,9519
2612,general 也 可以 可以 做 一 个 定义 就是说 这 是 这 是 非 正,NN AD VV VV VV CD M NN AD PN VC PN VC AD AD,1,['general'],[0],['NN'],philosophy,train,9521
2613,呃 就 比如说 一 个 比如说 美国 的 学校 吧 他们 为了 所谓 的 叫 discrimination original,IJ AD AD CD M AD NR DEG NN SP PN P JJ DEG VV NN NN,more,,,,philosophy,train,9526
2614,还是说 因为 这样 自由 其实 会 导致 呃 discrimination 是 其实 你 这 种 freedom 带来 是 另外 一 种,AD P JJ NN AD VV VV IJ NN VC AD PN DT M NN VV VC DT CD M,2,"['discrimination', 'freedom']","[8, 14]","['NN', 'NN']",philosophy,train,9534
2615,另外 呃 in quality 的 问题 所以 我 觉得,AD IJ P NR DEG NN AD PN VV,more,,,,philosophy,train,9535
2616,就是 自由 就是 在 under under 呃 在 法律 环境 下面 的话 其实 他们 并没有 任何 任何 的 law 可是 这样 一 种,AD AD AD P NR NR IJ P NN NN NN SP AD PN AD DT DT DEG NN AD JJ CD M,more,,,,philosophy,train,9536
2617,所以 我 的 我 的 我 的 I what I mean is 就是说,AD PN DEG PN DEG PN DEG PN PN PN VV VC AD,more,,,,philosophy,train,9539
2618,冲突 的 时候 which side we should we should stand 就 我们 应该 怎么样 去 做 这个 选择,NN DEC NN VV NN PN VV PN JJ NN AD PN VV AD VV VV PN VV,more,,,,philosophy,train,9542
2619,我 觉得 这 是 一 个 非常 非常 open 的 question 然后 我 我 自己 本身 比较 confused,PN VV PN VC CD M AD AD VA DEC NN AD PN PN PN PN AD VA,3,"['open', 'question', 'confused']","[8, 10, 17]","['VA', 'NN', 'VA']",philosophy,train,9545
2620,I think 我 觉得 human have a soul,PN VV PN VV NR NR NN NN,more,,,,philosophy,train,9550
