1,我 刚刚 开始 record,PN AD VV NR,1,['record'],[3],['NR'],persona,train,0
2,嗯 hello 我 的 名字 叫 徐妍,IJ NR PN DEG NN VV NR,1,['hello'],[1],['NR'],persona,train,1
3,嗯 初次 见面 nice to meet you 嗯,IJ AD VV VA P URL PN IJ,more,,,,persona,train,2
4,今天 呢 我 非常 希望 能够 通过 这个 机会 去 跟 你 make friends,NT SP PN AD VV VV VV DT NN VV P PN VV NN,more,,,,persona,train,3
5,我们 平时 能够 遇见 其他 stranger 的 机会 其实 不 是 很多 所以 其实 这样 的 一 个 机会 我 还是 觉得,PN AD VV VV DT NN DEC NN AD AD VC CD AD AD VA DEC CD M NN PN AD VV,1,['stranger'],[5],['NN'],persona,train,5
6,很 honour 的,AD VA SP,1,['honour'],[1],['VA'],persona,train,6
7,嗯 我 不 知道 好像 我 不 太 确定 你 家 是 不 是 也 是 来自 一 个 similar city 所以,IJ PN AD VV AD PN AD AD VV PN NN VC AD VC AD VC VV CD M NN NN AD,more,,,,persona,train,10
8,嗯 接下来 我们 也 可以 再 接下来 我们 可以 讨论 一下 吃 海鲜 啊 also sea food also the sea shore also the sunlight something like that,IJ AD PN AD VV AD AD PN VV VV AD VV NN SP NR NN VV NR DT NN NN NN DT NN NN VV CS,more,,,,persona,train,11
9,我 的 hobby 是 读书,PN DEG NN VC VV,1,['hobby'],[2],['NN'],persona,train,13
10,and 我 也 很 喜欢 哈 outdoor 那些 运动,CC PN AD AD VV IJ VV DT NN,2,"['and', 'outdoor']","[0, 6]","['CC', 'VV']",persona,train,15
11,比如说 go hiking 啊 之类 的,AD VV NR SP NN DEG,more,,,,persona,train,16
12,ok 嗯,NN IJ,1,['ok'],[0],['NN'],persona,train,19
13,呃 我 我 有 我 的 其他 的 关于 我 其他 的 一些 hobby 啊,IJ PN PN VE PN DEG DT DEG P PN DT DEG CD NN SP,1,['hobby'],[13],['NN'],persona,train,31
14,i like i like 武侠 小小说 超超级 喜欢,NN VV AD VV NN NN AD VV,more,,,,persona,train,38
15,i remember 呃 在 我 本科 的 时候 我 花 过 挺 长 的 时间,NN NN IJ P PN NN DEC NN PN VV AS AD VA SP NN,more,,,,persona,train,41
16,嗯 对 啊 对啊 我 也 很 喜欢 reading books,IJ VA SP NN PN AD AD VV VV NN,more,,,,persona,train,47
17,看 谁 的 呃 一些 novel 所以 你 也 跟 我 说 了 你 喜欢 看 金庸 的 嘛,VV PN DEG IJ CD NN AD PN AD P PN VV AS PN VV VV NR DEG SP,1,['novel'],[5],['NN'],persona,train,49
18,嗯 actually i read i didn't read a lot of books about jin yong,IJ AD AD VV NN NN NN NN NN P JJ NN NN NN,more,,,,persona,train,51
19,because 嗯 其实 金庸 他 呃 相对来说,NR IJ AD NR PN IJ AD,1,['because'],[0],['NR'],persona,train,52
20,嗯 比较 old,IJ AD JJ,1,['old'],[2],['JJ'],persona,train,53
21,cruel thing like 武打 呀,NR NN VV NN SP,more,,,,persona,train,57
22,like 呃 江湖 啊,VV IJ NN SP,1,['like'],[0],['VV'],persona,train,58
23,呃 something like that 所以 我 基本上 我 看到 小 的 时候 看 的 都 是 一 种,IJ NN VV CS AD PN AD PN VV JJ DEG NN LC DEG AD VC CD M,more,,,,persona,train,59
24,love stories 或者是,VV NN CC,more,,,,persona,train,61
25,呃 比如说 关于 一些 神 啊 关于 god,IJ AD P CD NN SP P NR,1,['god'],[7],['NR'],persona,train,63
26,关于 一些 其他 的 奇奇怪怪 的 religions some something like that,P CD DT DEG VV DEC NN NN NN VV CS,more,,,,persona,train,64
27,嗯 关于 玄幻类 的 比如说 three body,IJ P NN DEG AD JJ NN,more,,,,persona,train,71
28,in Chinese is 三体,P NN VC NN,more,,,,persona,train,72
29,嗯 black forest theory,IJ NN JJ NN,more,,,,persona,train,76
30,他 的 imagination is so good,PN DEG NN VC NR NN,more,,,,persona,train,79
31,because i was already 被 被 这 本 书 吸引,NR NN NN NR SB LB DT M NN VV,more,,,,persona,train,98
32,嗯 usually I 呃 want to read some books before 期末 考试,IJ AD PN IJ VV P JJ NN AD VV NN NN,more,,,,persona,train,107
33,快快 要 期末 考试 了 他 可能 觉得 非常 stress 非常 nervous,AD VV NN VV AS PN AD VV AD AD AD VA,2,"['stress', 'nervous']","[9, 11]","['AD', 'VA']",persona,train,109
34,他 想要 找 一些 东西 来 relax 所以 他 可能 会 选择 read some books try to like relax 吧,PN VV VV CD NN MSP VV AD PN VV VV VV NN NN AD VV P VV NN SP,more,,,,persona,train,110
35,我 特别 想 问 你 个 问题 你 喜欢 耽 美 小说 吗 it's like boys loves each other and they try to be together,PN AD VV VV PN M NN PN VV VV NR NN SP AD VV AD AD VV NN CC NN VV P JJ NN,more,,,,persona,train,112
36,and 嗯 many people even for some boys 可能 他 有 女朋友 they have girl friend but they try to they love each other,CC IJ JJ NN NN P NN AD VV PN VE NN VV JJ JJ NN CC NN VV P NN VV VV NN,more,,,,persona,train,113
37,no嗯 I have not read this book kind of book yeah so,NN PN VV AD VV PN AD VV P JJ NN NN,more,,,,persona,train,115
38,but for now 我 觉得 哦呃,AD P NN PN VV NN,more,,,,persona,train,116
39,but 呃 no I do,AD IJ NN PN VV,more,,,,persona,train,118
40,嗯 对 我 只是 比较 的 curious about it 因为 就是 merry many girls love it,IJ P PN AD VV DEC NN VV NN P AD VV JJ NN VV NN,more,,,,persona,train,119
41,对 我们 要不然 聊 一点 别的 吧 因为 我们 聊 reading books 聊 的 挺 久 的 了,P PN AD VV AD DT SP P PN VV JJ NN VV DEC AD VA SP SP,more,,,,persona,train,121
42,比如说 我们 聊一聊嗯嗯嗯 要不然 你 你 propose 一 个 吧 因为,AD PN VV AD PN PN VV CD M SP P,1,['propose'],[6],['VV'],persona,train,122
43,呃 我 的话 其实 各 种 类型 的 电影 都 还有 挺 ok 的,IJ PN SP AD DT M NN DEG NN AD CC AD VA SP,1,['ok'],[12],['VA'],persona,train,125
44,但是 也 不妨 一些 其他 的 那 种 青春 校园 类型 的 都 还 蛮 ok 的,AD AD AD CD DT DEG DT M JJ NN NN DEG AD AD AD VV SP,1,['ok'],[15],['VV'],persona,train,127
45,虽然 这 听起来 很 非常 的 没意思 totally impossible,CS PN AD AD AD DEV VV NN NN,more,,,,persona,train,130
46,呃 in this interview i can not remember any anyone of them,IJ P PN NN NN VV VV NN JJ NN P NN,more,,,,persona,train,135
47,嗯 which means that I actually I saw a lot 但 我 现在 啥 也 想 不 起来 了 对那 没有 办法,IJ NN NN CS PN VV PN NN NN NN AD PN NT PN AD VV AD VV AS NN VE NN,more,,,,persona,train,136
48,不 是 关于 love story,AD VC P VV NN,more,,,,persona,train,140
49,focus 放在 剧情 上 的 focus on the script but not the action but not the 特效,AD VV NN LC DEG NN P DT NN CC NN DT NN CC NN DT NN,more,,,,persona,train,143
50,but not the like the 画面 it's like that but 当 当然 画面 也 很 重要 啦,AD AD DT VV DT NN AD VV CS AD P AD NN AD AD VA SP,more,,,,persona,train,144
51,啊 view a good view is important,IJ NN NN NN NN VC NR,more,,,,persona,train,145
52,but 嗯,AD IJ,1,['but'],[0],['AD'],persona,train,146
53,oh I see 嗯,NN PN NN IJ,more,,,,persona,train,147
54,so 一 开始 是,NN AD VV VC,1,['so'],[0],['NN'],persona,train,156
55,呃 the plot and the whole story is also very interesting,IJ DT NN CC DT NN NN VC AD VV NR,more,,,,persona,train,166
56,哎呀 对 对 对 我 也 看 过 那部 电影 我 当时 这 部 电影 i watched about,IJ VA VA VA PN AD VV AS NN NN PN NT DT M NN NN VV NN,more,,,,persona,train,168
57,嗯 这 电影 真的 非常 的 yeah appealing,IJ DT NN AD AD DEV VV NR,more,,,,persona,train,170
58,呃 说起 这 部 电影 真的 是 嗯 我 觉得 很 sweet,IJ VV DT M NN AD VC IJ PN VV AD VA,1,['sweet'],[11],['VA'],persona,train,174
59,对 无论是 男生 还是 女生 都 非常 的 sweet and,P AD NN CC NN AD AD DEV VV CC,more,,,,persona,train,175
60,嗯 it' s 纯真,IJ AD NN VA,2,"[""it'"", 's']","[1, 2]","['AD', 'NN']",persona,train,177
61,嗯 I also really like the the 女主,IJ PN VV AD VV DT DT NN,more,,,,persona,train,180
62,非常 的 好 compare to the the other two the the other girl,AD DEV VA VV P DT DT NN NN DT DT NN NN,more,,,,persona,train,182
63,talk about the hair the finger nail the 度假 这 种 类型,NN VV DT NN DT NN NN DT NN DT M NN,more,,,,persona,train,184
64,觉得 差不多 了 can we stop,VV VA AS VV PN NN,more,,,,persona,train,186
65,那 我们 接下来 聊 一 聊 啊 education,AD PN AD VV CD VV SP NR,1,['education'],[7],['NR'],education,train,188
66,我 觉得 这个 问题 可能 说 ban 有点 太 那个 可以 说是,PN VV DT NN VV VV NN AD AD PN VV VV,1,['ban'],[6],['NN'],education,train,204
67,okay 的 教师 的话 可能 应该 在 学期 一 开始 之前,NR DEG NN SP AD VV P NN AD VV AD,1,['okay'],[0],['NR'],education,train,220
68,就 已经 先 规划 好 他 的 teaching plan 就是 他 的,AD AD AD VV VA PN DEG NN NN AD PN DEG,more,,,,education,train,221
69,呃 他 每 一 节 课 他 要 delivery 什么 东西 然后 他 的 homework 是 什么,IJ PN DT CD M NN PN VV VV DT NN AD PN DEG NN VC PN,2,"['delivery', 'homework']","[8, 14]","['VV', 'NN']",education,train,222
70,如果 他 能够 在 一 开始 他 就 已经 制定 出 他 的 一 个 schedule,CS PN VV P AD VV PN AD AD VV VV PN DEG CD M NN,1,['schedule'],[15],['NN'],education,train,223
71,a week 要 给 学生 布置 什么 作业 的话 其实 这个 量 是 不 会 超 标的,CD NN VV P NN VV DT NN SP AD DT NN VC AD VV VV NN,more,,,,education,train,225
72,但是 就是 可能 在 我们 之前 的 一些 这个 preview study process,AD AD AD P PN LC DEG CD DT NN NN NN,more,,,,education,train,226
73,plan 的 一 个 问题 那 就 很对,NR DEG CD M NN PN AD VV,1,['plan'],[0],['NR'],education,train,234
74,这 是 真的 是 老师 的 那个 teaching plan 和 它 的 一 个 衡量 的 问题,PN VC AD VC NN DEG DT JJ NN CC PN DEG CD M VV DEC NN,more,,,,education,train,235
75,how to say 就 是 这个 要看 你 追求 的 是 什么,VV P NR AD VC PN VV PN VV DEC VC PN,more,,,,education,train,246
76,呃 phd 的 一 个,IJ NN DEG CD M,1,['phd'],[1],['NN'],education,train,248
77,一 个 degree 只 是 一 个 degree 而已 然后 拿 它 去,CD M NN AD VC CD M NN AD AD VV PN VV,2,"['degree', 'degree']","[2, 7]","['NN', 'NN']",education,train,249
78,[ UNK ] research pursuit 这样 的话 我 觉得 没有 必要,PU NR PU NR NN VA SP PN VV VE NN,more,,,,education,train,251
79,因为 实际上 如果 你 不 想 做 research 你 只是 说 希望 能够 有 一 个 更 高 的 起点 在 那 种 company 里面 啊 这 种 实际上 国内 这种,P AD CS PN AD VV VV NN PN AD VV VV VV VE CD M AD JJ DEG NN P DT M NN NN SP DT M AD NN VV,2,"['research', 'company']","[7, 23]","['NN', 'NN']",education,train,253
80,因为 国内 其实 很多 university 它 有 那 种 跟 企业 的 合作,P NN AD CD NN PN VE DT M P NN DEG NN,1,['university'],[4],['NN'],education,train,254
81,更 更 容易 social 一点 其实 我 觉得,AD AD AD VV AD AD PN VV,1,['social'],[3],['VV'],education,train,257
82,比较 注重 就 是 social 这 一 块儿 嗯 实际上 对于,AD VV AD VC NN DT CD M IJ AD P,1,['social'],[4],['NN'],education,train,259
83,无论是 master 还是 phd,AD NN AD NN,2,"['master', 'phd']","[1, 3]","['NN', 'NN']",education,train,261
84,他们 都 会 关注 所 说 的 部分 关于 research 的 部分 他们 都 会 有 一 点 的 分心,PN AD VV VV MSP VV DEC CD P NN DEG CD PN AD VV VE CD M DEG VV,1,['research'],[9],['NN'],education,train,262
85,这个 实际上 对 research 是 不利 的 但是 实际上,DT AD P NN VC VA DEC AD AD,1,['research'],[3],['NN'],education,train,263
86,如果 说 你 以后 并不 想 做 research 这 实际上,CS VV PN AD AD VV VV NN PN AD,1,['research'],[7],['NN'],education,train,264
87,对 然后 但是 如果 你 真的 有 那 种 research pursuit 你 就 想,P AD AD CS PN AD VE DT M NN NN PN AD VV,more,,,,education,train,266
88,做 就 是 publish the best papers or publish the papers as much as,VV AD VC NN DT NN NN CC NR DT NN AD VV NN,more,,,,education,train,267
89,about social or 行政 这个 方面 的 事情,NR NN CC NN DT NN DEG NN,more,,,,education,train,273
90,但是 实际上 如果说 你 真的 想 做 research 的 话 就 对 你 实际上 也 是 有 好处 的 而且,AD AD CS PN AD VV VV NN DEC NN AD P PN AD AD VC VE NN DEC AD,1,['research'],[7],['NN'],education,train,277
91,你 没有 发 很多 paper 就 让 你 毕业 这种,PN AD VV CD NN AD VV PN VV VV,1,['paper'],[4],['NN'],education,train,280
92,国内 recruit 那 recruit professors or,NN NN DT NN NN CC,more,,,,education,train,283
93,呃 lectures,IJ NN,1,['lectures'],[1],['NN'],education,train,284
94,其实 我 几 个 月 前 有 考虑 过 要 不 要 读 phd,AD PN CD M NN LC VE VV AS VV AD VV VV NN,1,['phd'],[13],['NN'],education,train,286
95,然后 我 就 跟 career center 的 老师 聊 过,AD PN AD P NN VV DEC NN VV AS,more,,,,education,train,287
96,直接 ma 申 phd 其实 难度 会 比较 大,AD VV VV NN AD NN VV AD VA,2,"['ma', 'phd']","[1, 3]","['VV', 'NN']",education,train,289
97,而且 就 是 感觉 phd 真的 比较 适合 就是 对 research 很 有 passion 的 人 对,AD AD VC VV NN AD AD VV AD P NN AD VE NN DEC NN VA,3,"['phd', 'research', 'passion']","[4, 10, 13]","['NN', 'NN', 'NN']",education,train,293
98,就是 可能 我 读 phd 只是 为了 去 得到 这个 degree 然后 以后 可以 去 找 个 university 去 当 老师,AD AD PN VV NN AD P VV VV DT NN AD AD VV VV VV M NN VV VV NN,3,"['phd', 'degree', 'university']","[4, 10, 17]","['NN', 'NN', 'NN']",education,train,296
99,这 是 可能 对于 做 一 个 很 棒 的 一 个 research project 其实 没有 这 种 想法,PN VC AD P VV CD M AD JJ DEG CD M NN NN AD VE DT M NN,more,,,,education,train,297
100,对 所以 就 感觉 可能 并没有 太 适合 读 phd,P AD AD VV VV AD AD VV NN NN,1,['phd'],[9],['NN'],education,train,298
101,而且 就 很 担心 读读 一 个 呃 degree 出来 要 四五年 嘛,AD AD AD VV VV CD M IJ VV VV VV NT SP,1,['degree'],[8],['VV'],education,train,299
102,然后 其实 我 也 很 想 知道 你们 就是 像 周围 phd 的话 生活 是 什么样的,AD AD PN AD AD VV VV PN AD P NN NN SP NN VC VV,1,['phd'],[11],['NN'],education,train,301
103,你们 的 daily 是 大概 是 什么 样子 的 这样子,PN DEG NN VC AD VC DT NN DEC VA,1,['daily'],[2],['NN'],education,train,303
104,嗯 so for me is not a education,IJ NN P NN VC NR NN NN,more,,,,education,train,304
105,是 他 的 supervision 实际上 是 很 有限 的,VC PN DEG NN AD VC AD VA SP,1,['supervision'],[3],['NN'],education,train,308
106,当然 你 你 也 可以 去 寻求 帮助 但是 主要 是 你自己 的 motivation self motivation 一定 要 强 就 是 你自己,AD PN PN AD VV VV VV NN AD AD VC PN DEG NN NN NN AD VV VA AD VC PN,more,,,,education,train,309
107,而 下午 大家 基本 都 在 然后 自己 忙 自己 的 事情 如果说 有的 时候 有 team work 这种,AD NT PN AD AD VV AD PN VV PN DEG NN CS DT NN VE NN NN AD,more,,,,education,train,314
108,可能 会 下午 discuss一下 呀,AD VV NT NN SP,1,[],[],[],education,train,315
109,就是 no one assign you to do something,AD NN AD VV PN P VV NR,more,,,,education,train,324
110,motivation 你们 才 可以 去 做 如果 是 我 我 可能 会 很 闲鱼 呆在 家里,NN PN AD VV VV VV CS VC PN PN AD VV AD VA VV NN,1,['motivation'],[0],['NN'],education,train,338
111,因为 我们 我 真的 其实 这个 学期 我们 就是 三 节 课 然后 再 加 一 个 research project 嘛,P PN PN AD AD DT NN PN AD CD M NN AD AD VV CD M NN NN SP,more,,,,education,train,343
112,然后 就 最近 一直 在 做 research project 然后,AD AD NT AD AD VV NN NN AD,more,,,,education,train,344
113,有 大概 有 feel 到 一点 那 种 感觉,VE AD VE NN VV CD DT M NN,1,['feel'],[3],['NN'],education,train,345
114,但是 就是 你 要 找到 一 个 合适 的 topic 去 写,AD AD PN VV VV CD M JJ DEG NN VV VV,1,['topic'],[9],['NN'],education,train,346
115,所以 感觉 是 真的 要 很 academic 的 人才 能够 hold 住,AD VV VC AD VV AD JJ DEG NN VV VV VV,2,"['academic', 'hold']","[6, 10]","['JJ', 'VV']",education,train,349
116,啊呀 it's maybe it's for P H D,IJ AD AD AD P NN CD FW,more,,,,education,train,357
117,对 然后 当时 我 的 lecturer 就 跟我 讲 说,P AD NT PN DEG NN AD AD VV VV,1,['lecturer'],[5],['NN'],education,train,362
118,他 是 学了 linguistic 的,PN VC NN NN SP,1,['linguistic'],[3],['NN'],education,train,364
119,然后 你 要 把 一 个 很 虚 的 concept,AD PN VV BA CD M AD VA DEC NN,1,['concept'],[9],['NN'],education,train,381
120,变成 一 个 很 实 的 一 个 paper 说来 其 实是,VV CD M AD JJ DEG CD M NN VV PN NN,1,['paper'],[8],['NN'],education,train,382
121,对 所以 就 等于 如果 你 读 文学 P H D 的话 你 需要,P AD AD VV CS PN VV NN NN CD NN SP PN VV,more,,,,education,train,386
122,应该 是 就是 computer science 整体 上 我 怎么 说 节奏 比较 快,VV VC AD NN NN NN LC PN AD VV NN AD VA,more,,,,education,train,392
123,走向 有 什么 影响 或者 你 也 可以 感受 到 你 真的 在 follow 他 的 一些 trade,VV VE DT NN CC PN AD VV VV VV PN AD P VV PN DEG CD NN,2,"['follow', 'trade']","[13, 17]","['VV', 'NN']",education,train,398
124,像 读 材料 啊 或者说 像 读 你 的 linguistic 这 种 方向 我 觉得 很,P NN NN SP AD P VV PN DEG NN DT M NN PN VV AD,1,['linguistic'],[9],['NN'],education,train,401
125,influence 看出来 了 太慢了,NR VV AS NR,1,['influence'],[0],['NR'],education,train,403
126,就是 他 需要 你 不停 地 去 找 规律 的 一 个 过程 但 不 是 每 个 人 都 能够 像 professor 一样 就 很 聪明 然后 能够 快速 找到 里面 的 规律 很,AD PN VV PN AD DEV MSP VV NN DEC CD M NN AD AD VC DT M NN AD VV P NN VA AD AD VA AD VV AD VV NN DEG NN AD,1,['professor'],[22],['NN'],education,train,409
127,嗯 ok,IJ NN,1,['ok'],[1],['NN'],education,train,414
128,我 还 以为 你们 会 有 一 个 特殊 的 那 种 learning commerce 因为 我 知道 我们 学院 的,PN AD VV PN VV VE CD M VA DEC DT M JJ NN P PN VV PN NN DEG,more,,,,education,train,427
129,这 种 R P G 还有 P H D 是 有的,DT M NN NN NR CC NN CD NN VC PN,more,,,,education,train,428
130,我们 没有 啊 we have no this,PN AD SP PN VV NN PN,more,,,,education,train,431
131,就是 那 种 study environment 特别 好,AD DT M NN NN AD VA,more,,,,education,train,434
132,对 对 对 我 很 喜欢 这里 的 library,VA VA VA PN AD VV PN DEG NN,1,['library'],[8],['NN'],education,train,435
133,就 感觉 比 我 U G 的 library 要 好 很多,AD VV P PN NN CD DEG NN VV VA CD,more,,,,education,train,436
134,就是 L G four,AD JJ FW VA,more,,,,education,train,438
135,可能 因为 我 一般 都 在 L G 玩,AD P PN AD AD P JJ FW VV,more,,,,education,train,443
136,啊L G 对 L G 吧 它 是 那种 玻璃,AD FW P JJ FW SP PN VC NR NN,more,,,,education,train,444
137,[ UNK ] 我 总 觉得 L G 那 有 一 点,PU NR PU PN AD VV JJ FW PN VE CD M,more,,,,education,train,447
138,noisy 对,NR VA,1,['noisy'],[0],['NR'],education,train,449
139,对 因为 很多 人 就 在 那 groups study 的 那 种,P P CD NN AD P DT NN NN DEG DT M,more,,,,education,train,450
140,然后 如果 是 一 群 的话 那 就 哦 so noisy,AD CS VC CD M SP PN AD IJ NR NR,more,,,,education,train,458
141,然后 昨晚 凌晨 两点 的 时候 就 是 我们 呃 take photos 然后,AD NT NT NT DEG NN AD VC PN IJ NN NN AD,more,,,,education,train,464
142,就 感觉 可能 是 真的 是 final 到 了 然后 就 大家 都 在 很忙,AD VV VV VC AD VC VV VV AS AD AD PN AD AD VA,1,['final'],[6],['VV'],education,train,466
143,诶 那 你们 什么 时候 final 结束 啊,IJ AD PN DT NN NN VV SP,1,['final'],[5],['NN'],education,train,467
144,i don't know why but 呃 这 中间 有一个,NN VV VV NN CC IJ PN NN VV,more,,,,education,train,475
145,因为 我们 的 我们 的 那个 学生 visa 不 是 大概,P PN DEG PN DEG DT NN NR AD VC AD,1,['visa'],[7],['NR'],education,train,479
146,然后 那个 时候 你 拿到 你 的 certificate 那 时候 你 才 是 真的 毕业 了,AD DT NN PN VV PN DEG NN DT NN PN AD VC AD VV SP,1,['certificate'],[7],['NN'],education,train,482
147,啊 but how how can you find a job in this interval,IJ AD AD AD VV PN VV CD NN P PN NN,more,,,,education,train,483
148,呃 究竟 应 不 应该 用 smart phone 的 问题 吧,IJ AD VV AD VV VV NN NN DEG NN SP,more,,,,technology,train,499
149,我 肯定 是 需要 smart phone 的,PN AD VC VV NN NN SP,more,,,,technology,train,507
150,children 我 觉得 children 的话 那 那 就 应该 是 from,NR PN VV NR SP DT AD AD VV VC P,3,"['children', 'children', 'from']","[0, 3, 10]","['NR', 'NR', 'P']",technology,train,510
151,嗯 early childhood to baby to senior high school,IJ AD VV P VV P NN VA NN,more,,,,technology,train,511
152,嗯 commit呃,IJ NR,1,[],[],[],technology,train,514
153,呃 in this,IJ P PN,more,,,,technology,train,523
154,parents 就 可以 呃,NN AD VV SP,1,['parents'],[0],['NN'],technology,train,525
155,有 很多 test 然后 有 中考 啊 有 高考 啊,VE CD NN AD VE NN SP VE NN SP,1,['test'],[2],['NN'],technology,train,530
156,就 因为 现在 的 smart phone 也是,AD P NT DEG NN NN AD,more,,,,technology,train,531
157,呃 一些 软件 app 是,IJ CD NN NN VC,1,['app'],[3],['NN'],technology,train,532
158,呃 有 一些 大家 都 需要 比如说 WeChat 比如说 qq 虽然 我 也 现在 不 怎么 用 qq 了,IJ VE CD PN AD VV AD NR AD NN CS PN AD NT AD AD VV NN SP,3,"['WeChat', 'qq', 'qq']","[7, 9, 17]","['NR', 'NN', 'NN']",technology,train,534
159,比如说 我 用 的 比较 多 是 微博 孩子们 也 是 children 也 是 他们 也是 用嗯,AD PN VV DEC AD AD VC NN NN AD VC NR AD VC PN AD VV,1,['children'],[11],['NR'],technology,train,535
160,呃 微博呃 WeChat 比较 多 嘛,IJ NN NR AD VA SP,1,['WeChat'],[2],['NR'],technology,train,537
161,呃 communication,IJ NN,1,['communication'],[1],['NN'],technology,train,539
162,不管是 跟 teacher 还是 parents 还是 自己 的 同伴,AD P NN AD AD AD PN DEG NN,2,"['teacher', 'parents']","[2, 4]","['NN', 'AD']",technology,train,540
163,但是 嗯 app 上 那些 信息 就是 比较 良莠 不 齐 了,AD IJ AD VV DT NN AD AD VA AD VA SP,1,['app'],[2],['AD'],technology,train,543
164,而 去 play games,AD VV AD VV,more,,,,technology,train,547
165,他 可能 会 indulge,PN VV VV VV,1,['indulge'],[3],['VV'],technology,train,548
166,呃 smart phone 需要 是 需要 的 关键 是,IJ NN NN VV VC VV DEC NN VC,more,,,,technology,train,556
167,孩子 需 如果 是 大一点 的 孩子 的话 他们 需要 smart phone 但是 从 我的,NN VV CS VC NN DEG NN SP PN VV NN NN AD P NN,more,,,,technology,train,562
168,但 我 觉得 比较 小 的 孩子 比如说 那些 primary school 的话 我 觉得 他们 可能 不 需要 smart phone,AD PN VV AD VA DEC NN AD DT NN NN SP PN VV PN AD AD VV NN NN,more,,,,technology,train,563
169,因为 现 因为 那 时候 他们 还 小 他们 其实 没有 太 多 的 那个 判断 能力 没有 什么 judgement 所以,P AD P DT NN PN AD JJ PN AD VE AD CD DEG DT NN NN VE DT NN AD,1,['judgement'],[19],['NN'],technology,train,565
170,就是 我 我 的 sister 会 把 他 送到 呃 那个 school 去 然后,AD PN PN DEG NN VV BA PN VV IJ DT NN VV AD,2,"['sister', 'school']","[4, 11]","['NN', 'NN']",technology,train,573
171,然后 我 妈 我 我妈 会 把 他 那个 接接 回来 所以 他们 most of time 他们 就 是 under watch 的 要不然 就是 在 school 要不然 就 是 在 家 at home 要不然 就是 在 school,AD PN NN PN NN VV BA PN DT VV VV AD PN NN P VV PN AD VC NN VV DEC AD AD P NN AD AD VC P NN P NN AD AD P NR,more,,,,technology,train,575
172,他们 在 学校 的 那个 整个 的 呃 period 都 是 well well organized 的 因为 就是说,PN P NN DEG DT DT DEG IJ NN AD VC JJ NN VV DEC P AD,more,,,,technology,train,580
173,你 哪个 时间段 啊 上 什么 课 你 只要 上 什么 课 都 是 非常 非常 的 clear,PN DT NN SP VV DT NN PN AD VV DT NN AD VC AD AD DEV VA,1,['clear'],[17],['VA'],technology,train,581
174,所以 所以 我 觉得 他们 在 这个 阶段 并不 需要 太 多 smart phone 而且 他们 这时候 其实 最 需要 的 是 去 学习 一些,AD AD PN VV PN P DT NN AD VV AD CD NN NN AD PN AD AD AD VV DEC VC VV VV CD,more,,,,technology,train,582
175,basic knowledge 然后 他们 其实 可以 和,JJ NN AD PN AD VV CC,more,,,,technology,train,583
176,即便是 without 他们 也 可以 和 那个,AD P PN AD VV P DT,1,['without'],[1],['P'],technology,train,586
177,和 classmates 玩 得 比较 high,P NR VV DER AD VA,2,"['classmates', 'high']","[1, 5]","['NR', 'VA']",technology,train,587
178,呃 真人 一起 就是 和 real people 一 起 play 的 过程,IJ NN AD AD P JJ NN CD M NN DEG NN,more,,,,technology,train,591
179,但是 他们 会 很 cares 因为 家长 都会 有 手机 嘛 因为 他们 都 会 很 cares 说 你们 你们 到底 在 玩 什么 什么 呃 what's inside in smart phone,AD PN VV AD AD P NN NN VE NN SP P PN AD VV AD NR VV PN PN AD AD VV PN PN IJ NN NN P NN NN,more,,,,technology,train,593
180,因为 当 因为 那个 当 你 当你 到 了 比如说 你 到 了 那个 middle school 或者是 high school 的 时候,P P P DT P PN VV VV AS AD PN VV AS DT NN NN CC VA VA DEC NN,more,,,,technology,train,597
181,大家 都 会 有 自己 的 思想 他们 小孩子 都 他们 已经 长大 了 他们 会 去 需要 呃 需要 去 和 同学们 去 做 更 多 的 沟通 communication 啊,PN AD VV VE PN DEG NN PN NN AD PN AD VV AS PN VV VV VV SP VV VV P NN MSP VV AD CD DEG NN NN SP,1,['communication'],[29],['NN'],technology,train,598
182,呃 去 study together 啊 所以 那个 时候 家长 能 给 得 help 已经 非常 非常 limited 的 所以 我 觉得 尤其是,IJ VV NR NN SP AD DT NN NN VV VV DER NN AD AD AD VA DEC AD PN VV AD,more,,,,technology,train,600
